"id","title","category","description","backgroundColor","coverImage","genre","youtubeId","availableLanguages"
"adventure-world","冒険の世界","2025 アニメ・ファンタジー","ファンタジーアニメ「冒険の世界」です。魔法と冒険の世界をお楽しみください。

魔法が存在する世界で、主人公が仲間たちと共に冒険を繰り広げるファンタジーアニメです。美しいアニメーションと心躍る冒険ストーリーで、子供から大人まで楽しめる作品です。

視聴時間：約85分
言語：日本語、英語、韓国語、中国語対応
字幕：日本語、英語、韓国語、中国語対応

声優：
・主人公：田中勇気
・ヒロイン：佐藤愛
・相棒：鈴木元気
・監督：山田アニメ

この作品は、機内での快適な時間をお過ごしいただくために特別に制作されました。魔法と冒険の世界をお楽しみください。","#f39c12","image/covers/adventure-world.jpg","ファンタジー","dQw4w9WgXcQ","[""ja"", ""en"", ""ko"", ""zh""]"